{
  "$schema": "../schema/walkthrough.schema.json",
  "version": "cw/1",
  "title": "cw, walked through itself",
  "source": {
    "kind": "subsystem",
    "provider": "github",
    "repo": "sjroesink/cw",
    "number": "the cw binary",
    "url": "https://github.com/sjroesink/cw"
  },
  "summary": "This walkthrough explains the tool that is showing it. Three parts: what a walkthrough actually is and what is checked about it, what the local reader can do because it has your working tree in front of it, and what the published page does instead, having neither your tree nor your editor. Every snippet below is sliced out of this repository by examples/rebuild.py, so it is the real code or the check fails.",
  "root": "..",
  "language": "go",
  "parts": [
    {
      "title": "A walkthrough is a file",
      "desc": "One JSON document, a schema that is both the authoring contract and what the server enforces.",
      "long": "Nothing in the page or the server knows any topic. They read a document and render whatever is in it, which is what makes it possible for something else to read the same document: an editor plugin, or something that reads it out loud. That only works if the document says which format it is in and states its own facts in full, so that is what cw/1 is for.",
      "files": [
        "doc.go",
        "schema.go",
        "walkthrough.schema.json"
      ],
      "sections": [
        {
          "title": "The document, and its version",
          "desc": "What is in a walkthrough, and why it says so out loud.",
          "steps": [
            {
              "title": "The whole content is one struct",
              "body": "A walkthrough is a title, a summary, and a list of parts that hold sections that hold steps. There is no template and no per-topic code anywhere: adding a walkthrough is adding a file.",
              "code": {
                "file": "doc.go",
                "from": 21,
                "text": "type Doc struct {\n\tSchema   string         `json:\"$schema,omitempty\"`\n\tVersion  string         `json:\"version\"`\n\tTitle    string         `json:\"title\"`\n\tSource   *Source        `json:\"source,omitempty\"`\n\tSummary  string         `json:\"summary,omitempty\"`\n\tRoot     string         `json:\"root,omitempty\"`\n\tLanguage string         `json:\"language,omitempty\"`\n\tParts    []Part         `json:\"parts\"`\n\tExt      map[string]any `json:\"ext,omitempty\"`\n}\n\n// The two versions of the format this build reads. A document says which one\n// it is, and that is the only thing that decides how it is read and rendered.\n// FormatDefault is what a new walkthrough is written as.\nconst (\n\tFormatV1      = \"cw/1\"\n\tFormatV2      = \"cw/2\"\n\tFormatDefault = FormatV2\n)",
                "hi": [
                  23,
                  37,
                  38
                ],
                "notes": [
                  {
                    "line": 37,
                    "text": "The one field that has to be an exact value, and there are two of them now. A reader that does not know the version refuses the file instead of guessing which half of it it still understands."
                  }
                ]
              },
              "diagram": {
                "kind": "flow",
                "caption": "One document, and more than one thing that can read it.",
                "def": "flowchart LR\n  json[\"walkthrough.json\"] --> schema[\"walkthrough.schema.json\"]\n  schema --> local[\"cw serve\"]\n  schema --> host[\"cw host\"]\n  local --> tree[\"your working tree\"]\n  host --> gh[\"GitHub\"]\n  json -.-> other[\"an editor plugin,\\nsomething that reads it aloud\"]",
                "refs": {
                  "schema": {
                    "file": "schema.go",
                    "from": 233,
                    "note": "The same schema an editor validates against is enforced here, so the two cannot drift apart.",
                    "code": "func (v *validator) walk(at string, value any, sch map[string]any) {\n\tsch = v.resolve(sch)\n\tif len(sch) == 0 {\n\t\treturn\n\t}\n\n\tif want, ok := sch[\"type\"].(string); ok && !typeMatches(want, value) {\n\t\tv.fail(at, \"should be %s, not %s\", want, kindOf(value))\n\t\treturn\n\t}"
                  }
                }
              }
            },
            {
              "title": "Where it came from is one block, not four fields",
              "body": "The repository, the pull request and the commit used to be loose strings for the header. Together they are the only thing that can turn a file path and a line number into a link, so they belong in one place a machine can read.",
              "callout": "commit is what makes a link permanent. Without it a snippet can only point at a branch tip, which is a link that quietly starts lying.",
              "code": {
                "file": "doc.go",
                "from": 42,
                "text": "// Source is where the walkthrough came from, in a form something other than a\n// human can act on. It is what turns a path plus a line number into a link.\ntype Source struct {\n\tKind         string   `json:\"kind,omitempty\"`\n\tProvider     string   `json:\"provider,omitempty\"`\n\tRepo         string   `json:\"repo,omitempty\"`\n\tNumber       string   `json:\"number,omitempty\"`\n\tURL          string   `json:\"url,omitempty\"`\n\tState        string   `json:\"state,omitempty\"`\n\tCommit       string   `json:\"commit,omitempty\"`\n\tBase         string   `json:\"base,omitempty\"`\n\tHead         string   `json:\"head,omitempty\"`\n\tChangedFiles []string `json:\"changedFiles,omitempty\"`\n}",
                "hi": [
                  49,
                  52
                ]
              }
            }
          ]
        },
        {
          "title": "What a schema cannot say",
          "desc": "The checks that need to look at the content, not the shape.",
          "steps": [
            {
              "title": "An anchor has to match the text under it",
              "body": "A snippet states where it ends and what it hashes to. Both are written by the publisher rather than by hand, so if they disagree with the text, the text was edited afterwards and the anchor is now something a consumer would act on and be wrong about.",
              "code": {
                "file": "doc.go",
                "from": 294,
                "text": "// anchorErrs holds to and sha to what the text actually is. Both are written by\n// cw publish rather than by hand, so a mismatch means the snippet was edited\n// afterwards and the anchor is now a lie a consumer would act on.\nfunc anchorErrs(errf func(string, ...any), at string, from, to int, sha, text string) {\n\tif to != 0 {\n\t\twant := from + snippetLines(text) - 1\n\t\tif from == 0 {\n\t\t\twant = snippetLines(text)\n\t\t}\n\t\tif to != want {\n\t\t\terrf(\"%s: to is %d and the snippet ends at %d. Leave it out and it is filled in on publish\", at, to, want)\n\t\t}\n\t}\n\tif sha != \"\" && sha != snippetSha(text) {\n\t\terrf(\"%s: sha does not match the text, so it was edited after the hash was written. Leave it out and it is filled in on publish\", at)\n\t}\n}",
                "hi": [
                  303,
                  307
                ]
              }
            },
            {
              "title": "Two ids in one place is worse than none",
              "body": "Progress and every deep link hang off the ids in the document. Two siblings with the same id means a link lands on whichever one the reader's browser happened to find first, which is why this is an error rather than a warning.",
              "code": {
                "file": "doc.go",
                "from": 175,
                "text": "\t// An id is what a reader's progress and every deep link hang off, so two of\n\t// them in one place is worse than none: it silently sends people to the\n\t// wrong step.\n\tpartIDs := map[string]bool{}\n\tunique := func(seen map[string]bool, id, at string) {\n\t\tif id == \"\" {\n\t\t\treturn\n\t\t}\n\t\tif seen[id] {\n\t\t\terrf(\"%s: the id %q is already taken at this level, so a link to it is ambiguous\", at, id)\n\t\t}\n\t\tseen[id] = true\n\t}",
                "hi": [
                  183,
                  184
                ]
              }
            }
          ]
        }
      ]
    },
    {
      "title": "Where the code is",
      "desc": "The local reader has your working tree and your editor, and both are things worth being careful with.",
      "long": "Running cw serve puts a server on your machine that reads your files and starts your editor. That is a lot of authority for a page in a browser to have, so most of the interesting code here is about what it refuses rather than what it does.",
      "files": [
        "main.go",
        "doc.go",
        "ide.go"
      ],
      "sections": [
        {
          "title": "Nothing else gets to drive it",
          "desc": "Two refusals before any path is resolved.",
          "steps": [
            {
              "title": "The caller has to prove where it came from",
              "body": "A server on localhost can be reached by any site you have open. So the origin has to be this loopback server, and the caller has to know the token that was stamped into the page when it was served. Only then does anything get read.",
              "code": {
                "file": "main.go",
                "from": 765,